Title,Description,Course_Link,Course_Rating,Rating_Number,Course_Completed_By,Instructor,Instructor_Link,Instructor_Rating,Rating_Out_Of,Learners_Age_Range,Learners_Per_Class,Course_Price
1:1 Math Tutoring for Learners in Grades 1-6,"This tutoring class is for students in grades 1-6, in any area in math. The structure will be tailored to the students needs and can include homework help, concept review or full curriculum instruction. #confidence",https://outschool.com/classes/11-math-tutoring-for-learners-in-grades-1-6-GL1KpHC6,5,5,30,Mind over Math - Tutoring and Group Classes,https://outschool.com/teachers/Mind-Over-Math,4.9,286,5-12,1,$35
"Geometry Full Curriculum | High School | 8th, 9th, 10th Grade","In this class students will learn Geometry concepts, how to solve different questions and master full curriculum in engaging way. Best fit for homeschool & after-school students. Try First Week For 50% Off!",https://outschool.com/classes/geometry-full-curriculum-high-school-ywPy0l9d,4.8,4,90,Learnish,https://outschool.com/teachers/Learnish,4.6,767,12-17,4-10,$38
Math Review: 4th and 5th Grade Math Practice and Review for 9-11 Year Olds,"In this ongoing 4th and 5th Grade Math practice and review class, students will spend time understanding, applying, analyzing and/or evaluating their skill of 4th and 5th grade Math concepts such as Multiplication, Division, Decimals, and Fractions.",https://outschool.com/classes/math-review-4th-and-5th-grade-math-practice-and-review-for-9-11-year-olds-38HqAWif,N/A,N/A,2,Ms. Julie-(B.S./MA RDG/MATH/ESL/ACE),https://outschool.com/teachers/Ms-Julie,4.8,671,9-12,1-5,$21
"1:1 Private Math Tutoring for Grades 1 to 8: Pre-Algebra, Algebra 1 & Geometry,","Boost your child's math skills with our 1:1 Private Math Tutoring, expertly designed to cover all grades Math. Our personalized approach, tailored to each student's needs, ensures optimal learning and growth. Join now & multiply your child’s success! #confidence",https://outschool.com/classes/11-private-math-tutoring-for-grades-1-to-8-pre-algebra-algebra-1-geometry-Tz7WqvEV,5,4,29,Learnish,https://outschool.com/teachers/Learnish,4.6,767,6-15,1,$35
Learn Maths! UK Teacher & Curriculum for Ages 7-9 - For All Nationalities,"Full maths curriculum for Ages 7-9. In this engaging, visual on-going weekly math class, students will learn a new skill and how to apply it - Number & Place Value, Calculations, Fractions, Geometry, Measurement and Statistics.",https://outschool.com/classes/learn-maths-uk-teacher-curriculum-for-ages-7-9-for-all-nationalities-v1Z3PZJy,N/A,N/A,2,"Teacher Heidi - BSc., PGCE",https://outschool.com/teachers/Heidi-Evans,5,19,7-9,1-4,$11
Third Grade Math Spanish Immersion,This is an ongoing class to practice multiplication tables in Spanish. Your learner will also practice saying and writing numbers up to the hundreds place. #academic,https://outschool.com/classes/third-grade-math-spanish-immersion-1gye7DkL,N/A,N/A,1,Fabiola Woerner M.A. TESOL The Bilingual Educator,https://outschool.com/teachers/Fabiola-Woerner,5,107,9-10,4-6,$11
6th Grade Math | Full Curriculum | 2 Classes/Week,This is a full curriculum class covering grade 6 math topics. Ideal for homeschool and after school learners. This is an interactive class- learners will participate in activities and math games to reinforce their learning while having fun!,https://outschool.com/classes/6th-grade-math-full-curriculum-9WHSRdeB,3,2,6,Mind over Math - Tutoring and Group Classes,https://outschool.com/teachers/Mind-Over-Math,4.9,286,9-13,1-12,$34
"Algebra 1 Full Course (Live Twice Per Week, Ongoing)","Weekly Algebra 1 topics (outlined in description) taught in a student-centered, engaging style! Perfect for homeschooled students wanting a full curriculum Algebra 1 course or students needing review or extra help on specific topics.",https://outschool.com/classes/algebra-1-full-course-live-twice-per-week-ongoing-qld6ci5M,N/A,N/A,3,Megan McAra (M. Ed) Math Class Can Be Fun!,https://outschool.com/teachers/Megan-Mc,5,86,12-16,3-8,$36
The Circus Is in Town! A Telling Time to the Quarter Hour Escape Adventure,"The circus is in town, but the animals are missing. Solve the ""Telling Time"" to the quarter hour math clues to find the animals so the show can go on.",https://outschool.com/classes/the-circus-is-in-town-a-telling-time-to-the-quarter-hour-escape-adventure-K8CZsY1j,5,3,11,"Sharon Gribble, MEd",https://outschool.com/teachers/Teacher_Sharon,4.9,489,6-9,1-6,$13
6th Grade Math Full Curriculum Project Based/Gamified Learning,"This course teaches the essential 6th grade math curriculum through printable lessons with feedback on student work, as well as pairing each lesson with a creative project or fun review game!",https://outschool.com/classes/6th-grade-math-full-curriculum-project-basedgamified-learning-O8tCLSPp,N/A,N/A,7,"Ms. Mac, B.S. Elementary Education",https://outschool.com/teachers/Ms-Mac-Farlane,4.7,17,10-13,3-7,$30
Patterns in Algebra: Critical Thinking Class Level 2,"In this small group Algebra prep course, students complete problem solving activities each week that will help them be more successful in Algebra. #academic",https://outschool.com/classes/patterns-in-algebra-critical-thinking-class-level-2-UlyvFovr,5,4,23,Mrs. Kennedy (M.Ed.),https://outschool.com/teachers/Mary-Kennedy,5,104,13-16,1-3,$13
Pre-Algebra: Changing Decimals to Fractions Review,"In this one time class, students will review changing decimals to fractions.",https://outschool.com/classes/pre-algebra-changing-decimals-to-fractions-review-ElOcXDwi,5,3,18,Ms. Julie-(B.S./MA RDG/MATH/ESL/ACE),https://outschool.com/teachers/Ms-Julie,4.8,671,9-14,5-8,$24
"Algebra 1 | Second Semester | Full Semester Course with Advanced Polynomials | Polynomials, Quadratics, & Other Functions for Algebra 1 | Exponential, Quadratic & Absolute Value Functions, Factoring Polynomials (Ongoing)","Perfect for Algebra 1 second semester level or prep for Algebra 2 first semester-absolute value and piecewise functions, exponentials, laws of exponents, factoring and quadratics, and graphing of polynomial functions. SAT / ACT prep and word problems that are application based are included. This is also a fabulous summer prep before taking Algebra 2.",https://outschool.com/classes/algebra-1-second-semester-full-semester-course-with-advanced-polynomials-polynom-yBzMxc3Q,5,15,94,Professor Kitty BS ChemE-UVa; MBA-Case Western,https://outschool.com/teachers/Professor-Kitty,5,369,11-16,5-12,$34
"Algebra 1, Full Curriculum, Ongoing Class, Three Days per Week, With a Licensed Math Teacher","This rigorous, ongoing course will cover the full year of Common Core Algebra 1.",https://outschool.com/classes/algebra-1-full-curriculum-ongoing-class-three-days-per-week-with-a-licensed-math-gOXrDfEt,5,2,9,Mrs. Mary,https://outschool.com/teachers/Mary-Goll,5,36,10-15,3-15,$60
Introduction to Beginning Division and Division Facts (Ongoing Math Class),"In this beginning division and division facts ongoing class, students will be introduced to division and division facts up to 12.",https://outschool.com/classes/introduction-to-beginning-division-and-division-facts-ongoing-math-class-3hEm5Hnf,5,7,29,Ms. Julie-(B.S./MA RDG/MATH/ESL/ACE),https://outschool.com/teachers/Ms-Julie,4.8,671,7-12,1-5,$24
6th Grade Math Chapter 2 (Fractions and Decimals),"In this multi-day class, students will be given opportunities to review and practice concepts and skills that are taught in Big Ideas Math, Grade 6, Chapter 2. #academic",https://outschool.com/classes/6th-grade-math-chapter-2-fractions-and-decimals-16iqqAvv,N/A,N/A,N/A,Shay Conaty,https://outschool.com/teachers/Shay,4.9,397,11-12,2-3,$90
Learn Art of Multiplication Till 100 Within Seconds,"In this exciting class, students will learn the trick of doing quick multiplications (eg 3 digit number with 1 digit). Please check the age before you enroll your child as this class requires kids to be comfortable with times table up to 9. #academic",https://outschool.com/classes/learn-art-of-multiplication-till-100-within-seconds-tTx9Zahm,4.7,191,1020,"Einsteins Square: Chess, Coding, Math, Art, Games",https://outschool.com/teachers/EinsteinsSquare,4.8,"4,766",10-15,2-5,$18
"Fractions for Beginners Read, Write, and Draw the Whole, Half, Third, and Fourth ESL Friendly CEFR B1 B2 C1 C2",Highly Interactive and Engaging in depth instruction will teach students to create and interpret fractions! #ACADEMIC,https://outschool.com/classes/fractions-for-beginners-read-write-and-draw-the-whole-half-third-and-fourth-esl-5SzKEN1t,4.9,12,63,"Jamie Jones, MSA",https://outschool.com/teachers/Jamie-Guthrie-Jones,4.9,"2,072",7-12,2-4,$15
Beginning Multiplication Facts 0 To 4,"In this beginning multiplication 0 to 4 facts ongoing class, students will be introduced to beginning Multiplication Facts 0 to 4.",https://outschool.com/classes/beginning-multiplication-facts-0-to-4-yQipAnci,5,1,9,Ms. Julie-(B.S./MA RDG/MATH/ESL/ACE),https://outschool.com/teachers/Ms-Julie,4.8,671,6-11,5-8,$24
Pre-Calculus for Mathematicians: Semester 1/2 Functional Topics (Ongoing),Mathematicians will learn and explore Pre-Calculus skills in this ongoing course with new principles covered each session. May be taken as a complete Pre-Calculus class or may supplement a traditional class. Prerequisite: Algebra II,https://outschool.com/classes/pre-calculus-for-mathematicians-semester-12-functional-topics-ongoing-l2qkaF8x,5,4,13,Kristen LeGeyt M.Ed. Secondary Mathematics,https://outschool.com/teachers/Kristen-Le-Geyt-M-Ed,5,210,14-18,2-18,$25
101 Private Customized Math Curriculum & Homework Help Grades 9 & 10 - 1 Hour Weekly,"In this class, student will receive a 1:1 private, individualized session with an experience High school Math teacher to help cover the curriculum or assignment help.",https://outschool.com/classes/101-private-customized-math-curriculum-homework-help-grades-9-10-1-hour-weekly-QRUc6tx1,N/A,N/A,N/A,StudentScholars,https://outschool.com/teachers/studentscholars,3.9,73,13-18,1-6,$43
"Multiplication Mayhem → Exciting, Game-Based Multiplication Practice","In this super fun ongoing class, students will get LOTS of practice with their multiplication facts, while having fun, making new friends, and interacting/competing with other learners.",https://outschool.com/classes/multiplication-mayhem-exciting-game-based-multiplication-practice-Bp1JF44x,N/A,N/A,N/A,"Mary Bailey, B. Ed.",https://outschool.com/teachers/Mary-202008,5,2,8-13,3-12,$25
Kindergarten Full Curriculum Learn at Home Standards-Aligned Lessons,In this 5x a week class we will meet for 80 minutes with a movement or potty break in the middle and cover all the standards and get them ready for 1st grade. Aligned with U.S. Core State Standards:,https://outschool.com/classes/kindergarten-full-curriculum-learn-at-home-standards-aligned-lessons-AaudLCZ6,N/A,N/A,1,"Trammell Classes Dragon Academy, DnD, Coding , RPG",https://outschool.com/teachers/Trammell-Classes,4.8,630,4-6,4-8,$98
Word Problems: 4th Grade Math,"In this ongoing course, students will solve word problems to learn, review and practice all crucial and required topics of fourth grade math, including multiplication, division, fractions, decimals and more. #academic",https://outschool.com/classes/word-problems-4th-grade-math-AK9sDlSe,N/A,N/A,9,Stone Bridges Academy,https://outschool.com/teachers/Stone-Bridges-Academy,4.9,277,8-10,1-6,$10
2ND Grade Math Review/3RD Grade Math Full Curriculum,"In this ongoing class, students will review/learn 2nd grade math #academic",https://outschool.com/classes/2nd-grade-math-review3rd-grade-math-full-curriculum-qVVmUceZ,4,1,2,"Teacher Shaniqua H, MSW",https://outschool.com/teachers/Shaniqua-Holmes,5,239,7-10,3-6,$12
Grade 2- Singapore Math - Full Year Program - 1 Hour Weekly,"In this class, learners will learn the full year Grade 2 Singapore Math Curriculum in a small group setting.",https://outschool.com/classes/grade-2-singapore-math-full-year-program-1-hour-weekly-BsEsS8sj,5,3,10,StudentScholars,https://outschool.com/teachers/studentscholars,3.9,73,5-9,2-4,$30
7th Grade Math Chapter 6 (Percents),"In this multi-day class, students will be given opportunities to review and practice concepts and skills that are taught in Big Ideas Math, Grade 7, Chapter 6. #academic",https://outschool.com/classes/7th-grade-math-chapter-6-percents-opPkwnus,N/A,N/A,N/A,Shay Conaty,https://outschool.com/teachers/Shay,4.9,397,12-13,2-3,$90
Math Made Fun (with music) - 2nd Grade Math Prep,"In this ongoing class, children will spend one day, each week, using music to make learning math fun.",https://outschool.com/classes/math-made-fun-with-music-2nd-grade-math-prep-BBFfvgZ7,5,1,1,Mr. Mike (MS SpEd),https://outschool.com/teachers/mikecohen,5,19,5-8,1-6,$20
After School One to One Math Tutoring,"This is a 50-minute tutoring session for students who need help in Pre-Algebra, Algebra, Pre-Calculus, Trigonometry or Calculus.",https://outschool.com/classes/after-school-one-to-one-math-tutoring-O5Mq5mkb,5,3,10,Tricha Louis,https://outschool.com/teachers/Miss-Louis,5,16,12-17,1-2,$50
Beginning Multiplication and Division Fact Families,"In this one time class, students will learn about Multiplication and Division Fact Families up to 12.",https://outschool.com/classes/beginning-multiplication-and-division-fact-families-s5k9ibqe,5,4,32,Ms. Julie-(B.S./MA RDG/MATH/ESL/ACE),https://outschool.com/teachers/Ms-Julie,4.8,671,7-12,5-7,$23
Learn Multiplication up to 100 Within Seconds (Two Digits by Two Digits),Students will practice mental maths by solving 2 digit multiplication with 2 digits within seconds and in a single line. #academic,https://outschool.com/classes/learn-multiplication-up-to-100-within-seconds-two-digits-by-two-digits-T2HwcAM1,4.8,65,324,"Einsteins Square: Chess, Coding, Math, Art, Games",https://outschool.com/teachers/EinsteinsSquare,4.8,"4,766",11-16,1-5,$15
Math Homeschool FULL Curriculum 4th Grade,Students will master 4th grade math standards. This is an interactive course. No Open Slots? Message Me and See You In Class!,https://outschool.com/classes/math-homeschool-full-curriculum-4th-grade-Inujscg8,N/A,N/A,1,"Courtney Daniels, Ed.S.",https://outschool.com/teachers/Mrs-Courtney-Daniels,5,13,8-9,1-5,$100
Aim High! | It's AB Calculus! | (Ongoing),#academic - A 50-minute session each week will strengthen skills while introducing the initial concepts of Calculus. Students with Algebra 2 and PreCalc skills can jump in at anytime. I cycle through all the concepts of the first semester of AB Calculus in such a modular way to treat each topic as introducing.,https://outschool.com/classes/aim-high-its-ab-calculus-yveSGR6H,5,1,23,Professor Kitty BS ChemE-UVa; MBA-Case Western,https://outschool.com/teachers/Professor-Kitty,5,369,14-18,3-12,$39
Introduction to Division: Beginning Division With and Without Remainders,"In this one time math class, students will learn and practice beginning division with and without remainders using division facts up to 12.",https://outschool.com/classes/introduction-to-division-beginning-division-with-and-without-remainders-izyQTuv3,4.8,25,127,Ms. Julie-(B.S./MA RDG/MATH/ESL/ACE),https://outschool.com/teachers/Ms-Julie,4.8,671,7-12,1-5,$22
Personalized 1-On-1 Math Tutoring Prek - 7th (Private Ongoing).,This ongoing one-on-one tutoring class will be designed specifically for your child around their current need or desire to advance or simply homework assistance.,https://outschool.com/classes/personalized-1-on-1-math-tutoring-prek-7th-private-ongoing-ZrgRIxIN,4.7,37,168,Teacher Rusty,https://outschool.com/teachers/Rusty-Thompson,4.8,116,4-14,1,$35
+ Tutoring for Mathematicians: Weekly Middle & High School Math Tutor (Ongoing),"Ongoing sessions for individual Algebra tutoring for mathematicians studying Pre-Algebra, Algebra I, or Algebra II. Topics covered will be personalized to meet the needs of each leaner.",https://outschool.com/classes/tutoring-for-mathematicians-weekly-middle-high-school-math-tutor-ongoing-xbXArJ3w,5,4,23,Kristen LeGeyt M.Ed. Secondary Mathematics,https://outschool.com/teachers/Kristen-Le-Geyt-M-Ed,5,210,13-17,1-2,$60
Pre-Algebra: Factors and Multiples Review,"In this one time course, students will review and practice finding the factors and multiples for given numbers.",https://outschool.com/classes/pre-algebra-factors-and-multiples-review-49IeA265,N/A,N/A,5,Ms. Julie-(B.S./MA RDG/MATH/ESL/ACE),https://outschool.com/teachers/Ms-Julie,4.8,671,8-13,5-8,$24
All About Multiplication and Division Fact Families Review,"In this multiplication and division fact families ongoing class, students will review and practice multiplication and division fact families.",https://outschool.com/classes/all-about-multiplication-and-division-fact-families-review-TP8OenfR,N/A,N/A,3,Ms. Julie-(B.S./MA RDG/MATH/ESL/ACE),https://outschool.com/teachers/Ms-Julie,4.8,671,8-13,1-5,$23
Preparing for 5th Grade Math,"Prepare for 5th grade math by reviewing major 4th grade math concepts with Wild and Unstructured Learning in this fun and engaging class! Learners will review long division, area, perimeter, fractions, and multiplication.",https://outschool.com/classes/preparing-for-5th-grade-math-6lWuwZzH,5,1,9,Wild and Unstructured Learning,https://outschool.com/teachers/Ms-Tiara,4.8,812,9-11,2-9,$252
Middle School Math - Ongoing Math Course,"In this ongoing course, a variety of math skills learned at a middle school level (traditionally 6th, 7th, & 8th grade) are covered week-by-week to supplement topics learned in the traditional classroom.",https://outschool.com/classes/middle-school-math-ongoing-math-course-sxWZEi6I,4.9,11,68,Ms. Sarah,https://outschool.com/teachers/Sarah-Clancy,5,382,11-13,1-8,$24
Fractions for Beginners - Minecraft Fractions! (Intro to Fractions as a Whole),"In this class students will learn the basic concept of fractions as a whole. If your child loves Minecraft, drawing and playing games they will enjoy this class! #academic",https://outschool.com/classes/fractions-for-beginners-minecraft-fractions-intro-to-fractions-as-a-whole-983qMAW2,5,20,110,Natalie Lipps,https://outschool.com/teachers/Natalie-Lipps,4.9,874,5-10,3-12,$16
Third Grade Full Math Curriculum Review Club,In this ongoing online course students will review third grade math concepts to develop mastery.,https://outschool.com/classes/third-grade-full-math-curriculum-review-club-rg3SMnOn,N/A,N/A,2,Jennafer Tucker,https://outschool.com/teachers/Jennafer-Tucker-2023,5,3,7-9,1-5,$10
Full Year of 4th Grade Singapore Math| the Path to Math Mastery (1x/Wk Ongoing),"In this class, learners will master math skill using the Singapore Math method. Learners will discuss and work on challenging problems with the teacher. They will be engaged in fun math games as well!",https://outschool.com/classes/full-year-of-4th-grade-singapore-math-8wf8dyhJ,5,4,38,Mentorhood Mathematics,https://outschool.com/teachers/Mentorhood-Learning-Center,4.8,287,8-10,2-6,$26
7th Grade Math Unit 3 (Proportionality and Percent),"In this multi-day class, students will be given opportunities to review and practice concepts and skills that are taught in Springboard Math, Course 2, Grade 7, Unit 3. #academic",https://outschool.com/classes/7th-grade-math-unit-3-proportionality-and-percent-xHFOuny3,N/A,N/A,N/A,Shay Conaty,https://outschool.com/teachers/Shay,4.9,397,12-13,2-3,$210
Forex Math: Mastering Foreign Currency Trading,"In this one-time class, students will gain a comprehensive understanding of forex trading, develop graph reading skills, and apply mathematical knowledge in real-world scenarios.",https://outschool.com/classes/forex-math-mastering-foreign-currency-trading-cyo5KjWE,N/A,N/A,7,USA's Prestige Worldwide Education,https://outschool.com/teachers/USAprestigeworldwide,4.9,82,10-15,2-8,$18
Crunching Numbers: Guided Math Story Problems (Advanced Multi-Step Problems),"In this ongoing class, students will participate in a small group math talk to practice breaking down and solving multi-step story problems. Students will also practice making sense of math problems and explaining their thought processes. #academic",https://outschool.com/classes/crunching-numbers-guided-math-story-problems-advanced-multi-step-problems-bgEoGwkx,4.2,5,28,"Katherine Jones, M.Ed.",https://outschool.com/teachers/Mrs-Jones,4.9,40,9-11,1-5,$10
Full Year of 2nd Grade Singapore Math| the Path to Math Mastery (1x/Wk Ongoing),"In this class, learners will master math skill using the Singapore Math method. Learners will discuss and work on challenging problems with the teacher. They will be engaged in fun math games as well!",https://outschool.com/classes/full-year-of-2nd-grade-singapore-math-7OdxILHN,4.3,3,78,Mentorhood Mathematics,https://outschool.com/teachers/Mentorhood-Learning-Center,4.8,287,6-8,2-6,$26
5th Grade Math Unit 6 (Geometry),"In this mutli-day class, students will be given opportunities to review and practice concepts and skills involving geometry at the fifth grade level. #academic",https://outschool.com/classes/5th-grade-math-unit-6-geometry-A4XesArk,5,4,13,Shay Conaty,https://outschool.com/teachers/Shay,4.9,397,10-11,2-3,$133
Spanish Math in Spanish Immersion,Practice and strengthen your first grade math skills in Spanish. This is a Math class for students in first grade.,https://outschool.com/classes/spanish-math-in-spanish-immersion-BdsWq6a8,5,3,18,Fabiola Woerner M.A. TESOL The Bilingual Educator,https://outschool.com/teachers/Fabiola-Woerner,5,107,6-7,4-4,$11
6th Grade Math Unit 6 (Data Analysis),"In this multi-day class, students will be given opportunities to review and practice concepts and skills that are taught in Springboard Math, Course 1, Grade 6, Unit 6. #academic",https://outschool.com/classes/6th-grade-math-unit-6-data-analysis-DxQssLz3,N/A,N/A,N/A,Shay Conaty,https://outschool.com/teachers/Shay,4.9,397,11-12,2-3,$45
7th Grade Math Unit 1 (Integer Operations and Rational Numbers),"In this mutli-day class, students will be given opportunities to review and practice concepts and skills involving integers and rational numbers at the seventh grade level. #academic",https://outschool.com/classes/7th-grade-math-unit-1-integer-operations-and-rational-numbers-eYapttuU,5,1,6,Shay Conaty,https://outschool.com/teachers/Shay,4.9,397,12-13,2-3,$126
"Distributive Property- Fall Review, Fun, and Games","In this one-time class, learners will experience fun, exciting, and engaging ways to review the distributive property of multiplication over addition while having a blast playing Kahoot games. Please note there is no formal lesson.",https://outschool.com/classes/distributive-property-fall-review-fun-and-games-VyXBGFmS,5,1,8,Ms. Nen,https://outschool.com/teachers/Teacher-Nen,4.6,120,9-14,3-6,$30
DnD Math Adventure Multiplication and Division with Dungeons and Dragons,Each week we will practice our multiplication and division facts while going on a short adventure with a DnD and fantasy theme,https://outschool.com/classes/dnd-math-adventure-multiplication-and-division-with-dungeons-and-dragons-KyNyLx6Q,N/A,N/A,N/A,"Trammell Classes Dragon Academy, DnD, Coding , RPG",https://outschool.com/teachers/Trammell-Classes,4.8,630,7-12,3-10,$15
IB Math SL Exam Preparation Topic : Trigonometry,I am going to teach students how to solve some IB SL Trigonometry problems. We will use materials on an IB math worksheet.,https://outschool.com/classes/ib-math-sl-exam-preparation-topic-trigonometry-kxMxiO21,N/A,N/A,N/A,Wai Choi,https://outschool.com/teachers/Wai-Choi,5,100,13-18,1-5,$65
Multiplication Times Table 1-20 Part-3,"My aim is to change your learners attitude about math forever! Students will learn amazing tricks to solve and memorize multiplication facts families 1-20 and in this part 3 class students will learn about 7,9,12,15 and 20 times tables.",https://outschool.com/classes/multiplication-times-table-1-20-part-3-JfYVLL4M,N/A,N/A,N/A,Bhuvi,https://outschool.com/teachers/Bhuvi,N/A,N/A,7-12,3-10,$20
"The Very Hungry Monster: A PreK Counting, Moving, and Drawing Session","In this one-time course, students will pretend to be monsters ready to join a counting and moving game! Children will then have the opportunity to draw pictures of their imaginary monsters to share with the group.",https://outschool.com/classes/the-very-hungry-monster-a-prek-counting-moving-and-drawing-session-WU00ZoKl,5,16,79,"Miss Brittany, M.S.Ed",https://outschool.com/teachers/Miss-Brittany-20210624,5,100,4-9,1-5,$12
United Kingdom IGCSE/GCSE Math Exam Preparation - Trigonometry,"We are going to explain the definition and application of Tangent, Sine and Cosine. Then we will illustrate the concept by solving some IGCSE/GCSE exam style questions.",https://outschool.com/classes/united-kingdom-igcsegcse-math-exam-preparation-trigonometry-hh624BSB,N/A,N/A,N/A,Wai Choi,https://outschool.com/teachers/Wai-Choi,5,100,14-18,1-6,$30
Counting American Money Amounts,"In this 5 week course, students will learn how count pennies, nickels, dimes, quarters, and dollars to find money amounts.",https://outschool.com/classes/counting-american-money-amounts-VmTgwl77,5,1,1,Kelsey G,https://outschool.com/teachers/Kelsey-G,5,216,6-8,3-4,$50
5th Grade Math Chapter 7 (Division with Decimals),"In this multi-day class, students will be given opportunities to review and practice concepts and skills that are taught in Big Ideas Math, Grade 5, Chapter 7. #academic",https://outschool.com/classes/5th-grade-math-chapter-7-division-with-decimals-TSh96UnF,N/A,N/A,N/A,Shay Conaty,https://outschool.com/teachers/Shay,4.9,397,10-11,2-3,$90
